{
  "$schema": "../studio.schema.json",
  "slug": "SLUG",
  "owner": {
    "email": "owner@example.com"
  },
  "name": "НАЗВАНИЕ СТУДИИ",
  "tagline": "Короткое описание — одна строка",
  "description": "Два-три предложения о студии.",
  "timezone": "Europe/Moscow",
  "contacts": {
    "phone": "+7 900 000-00-00",
    "address": "Город, улица, дом",
    "howToFind": "Как заехать и где оставить машину.",
    "mapUrl": ""
  },
  "branding": {
    "logo": "logo.svg",
    "hero": "hero.jpg",
    "icon192": "icon-192.png",
    "icon512": "icon-512.png"
  },
  "infoCards": [
    {
      "icon": "shield",
      "title": "Гарантия до 3 лет",
      "text": "На керамику и защитную плёнку — с ежегодной проверкой покрытия."
    },
    {
      "icon": "clock",
      "title": "Точно в срок",
      "text": "Называем время готовности при записи и сообщаем, если работа закончится раньше."
    },
    {
      "icon": "coffee",
      "title": "Зона ожидания",
      "text": "Кофе, Wi‑Fi и окно в бокс — можно наблюдать за работой."
    }
  ],
  "services": [
    {
      "id": "complex-wash",
      "name": "Комплексная мойка",
      "description": "Двухфазная мойка кузова, салон пылесосом, стёкла, чернение резины.",
      "price": 2500,
      "priceFrom": false,
      "durationMinutes": 90,
      "keywords": [
        "мойка",
        "помыть"
      ],
      "active": true
    },
    {
      "id": "polish-light",
      "name": "Лёгкая полировка",
      "description": "Убираем мелкие царапины и голограммы, возвращаем блеск за один день.",
      "price": 12000,
      "priceFrom": true,
      "durationMinutes": 240,
      "keywords": [],
      "active": true
    },
    {
      "id": "polish-restore",
      "name": "Восстановительная полировка",
      "description": "Многоэтапная полировка с замером толщины ЛКП и удалением глубоких дефектов.",
      "price": 25000,
      "priceFrom": true,
      "durationMinutes": 480,
      "keywords": [],
      "active": true
    },
    {
      "id": "ceramic",
      "name": "Керамическое покрытие",
      "description": "Подготовка, лёгкая полировка и два слоя керамики. Машина остаётся у нас на 2 дня.",
      "price": 35000,
      "priceFrom": true,
      "durationMinutes": 960,
      "keywords": [
        "керамика",
        "защита кузова"
      ],
      "active": true
    },
    {
      "id": "interior",
      "name": "Химчистка салона",
      "description": "Сиденья, потолок, ковры и пластик с обработкой паром и защитой кожи.",
      "price": 9000,
      "priceFrom": true,
      "durationMinutes": 300,
      "keywords": [
        "химчистка",
        "салон"
      ],
      "active": true
    },
    {
      "id": "headlights",
      "name": "Полировка фар",
      "description": "Убираем помутнение и желтизну, защищаем фары лаком.",
      "price": 3500,
      "priceFrom": false,
      "durationMinutes": 60,
      "keywords": [
        "фары"
      ],
      "active": true
    }
  ],
  "works": [
    {
      "id": "w1",
      "image": "work-1.jpg",
      "caption": "Белый седан после восстановительной полировки"
    },
    {
      "id": "w2",
      "image": "work-2.jpg",
      "caption": "Керамика в два слоя: глубина цвета и защита на 3 года"
    },
    {
      "id": "w3",
      "image": "work-3.jpg",
      "caption": "Синий купе — лёгкая полировка за один день"
    },
    {
      "id": "w4",
      "image": "work-4.jpg",
      "caption": "Колёсные диски после химчистки и защиты"
    }
  ],
  "schedule": {
    "weekly": {
      "mon": {
        "open": "10:00",
        "close": "21:00"
      },
      "tue": {
        "open": "10:00",
        "close": "21:00"
      },
      "wed": {
        "open": "10:00",
        "close": "21:00"
      },
      "thu": {
        "open": "10:00",
        "close": "21:00"
      },
      "fri": {
        "open": "10:00",
        "close": "21:00"
      },
      "sat": {
        "open": "10:00",
        "close": "21:00"
      },
      "sun": {
        "open": "11:00",
        "close": "19:00"
      }
    },
    "exceptions": [
      {
        "date": "2026-11-04",
        "hours": null,
        "note": "День народного единства"
      },
      {
        "date": "2026-12-31",
        "hours": {
          "open": "10:00",
          "close": "16:00"
        },
        "note": "Короткий день"
      },
      {
        "date": "2027-01-01",
        "hours": null,
        "note": "Новый год"
      }
    ]
  },
  "booking": {
    "bays": 2,
    "slotStepMinutes": 30,
    "bufferMinutes": 30,
    "minLeadMinutes": 120,
    "horizonDays": 30,
    "cancelMinHoursBefore": 24,
    "cancellationPolicy": "Если планы поменялись позже — просто позвоните, перенесём запись."
  }
}